{
  "$schema": "https://json-schema.org/draft/2020-12/schema",
  "$id": "quest.schema.json",
  "title": "ISP quest act",
  "description": "One act of the quest spine (docs/QUEST_SPINE.md). An act is a sequence of steps told by one narrator role; each step has a brief, an objective made of conditions on corporation state, and what is said when it is done. Quests never grant unlocks or credits of their own: the milestone ladder and the contracts do that.",
  "type": "object",
  "required": ["id", "act", "title", "narrator", "ladder", "opensWhen", "steps", "closes"],
  "additionalProperties": false,
  "properties": {
    "$schema": { "type": "string" },
    "id": { "type": "string", "pattern": "^act-[0-9]+$" },
    "act": { "type": "integer", "minimum": 1 },
    "title": { "type": "string", "minLength": 1 },
    "narrator": { "$ref": "#/$defs/role", "description": "Who tells this act, as a role. The client resolves the role to a character (name, title, portrait) from one registry, today public/scripts/liaison.js. Text never names the character; it uses {{speaker.name}}." },
    "ladder": {
      "type": "object",
      "description": "The span of the milestone ladder (data/milestones.json) this act walks: the corporation level it opens at and the level that closes it.",
      "required": ["from", "to"],
      "additionalProperties": false,
      "properties": { "from": { "type": "integer", "minimum": 0 }, "to": { "type": "integer", "minimum": 1 } }
    },
    "opensWhen": { "type": "array", "minItems": 1, "items": { "$ref": "#/$defs/condition" }, "description": "The act opens when any of these holds." },
    "steps": { "type": "array", "minItems": 1, "items": { "$ref": "#/$defs/step" } },
    "closes": {
      "type": "object",
      "required": ["handoff"],
      "additionalProperties": false,
      "properties": {
        "handoff": {
          "type": "object",
          "description": "The answer to 'what now?' when the act ends: the next act, and at least one objective and one pending outcome the player can see.",
          "required": ["nextAct", "shows"],
          "additionalProperties": false,
          "properties": {
            "nextAct": { "type": "string", "pattern": "^act-[0-9]+$" },
            "shows": {
              "type": "array",
              "minItems": 2,
              "items": {
                "type": "object",
                "required": ["kind"],
                "additionalProperties": false,
                "properties": {
                  "kind": { "enum": ["objective", "pending"] },
                  "text": { "type": "string" },
                  "source": { "$ref": "#/$defs/pendingSource" },
                  "label": { "type": "string" },
                  "payoff": { "type": "string" }
                }
              }
            }
          }
        }
      }
    }
  },
  "$defs": {
    "role": {
      "enum": ["coordinator"],
      "description": "Speaker roles. 'coordinator' is the Bureau officer assigned to every new corporation. New roles are added here and in the registry together."
    },
    "metric": {
      "type": "string",
      "description": "The milestone ladder's metric vocabulary (server/game/progression.js resolveMetric: stat:, employeeCount, miningLease:, building:, building-count:, totalMined:, unlockedTech:) plus the kinds this design proposes adding to that same resolver, each reading a state field that exists today: level (corp.level), walkthroughCompleted (playerProfile.walkthroughCompleted), missionActive:<id> (corp.activeMissions), missionCompleted:<id> (corp.completedMissions), dockedAt:<stationId> (corp.currentStationId), techQueued:<techId> (queues.corporateRnD), extractorsRunning (corp.mining.silicateExtractors[].active), stationStock:<stationId>:<item> (corp.inventory).",
      "minLength": 1
    },
    "condition": {
      "type": "object",
      "required": ["metric", "atLeast"],
      "additionalProperties": false,
      "properties": { "metric": { "$ref": "#/$defs/metric" }, "atLeast": { "type": "number" } }
    },
    "hintCondition": {
      "type": "object",
      "required": ["metric", "below"],
      "additionalProperties": false,
      "properties": { "metric": { "$ref": "#/$defs/metric" }, "below": { "type": "number" } }
    },
    "pendingSource": {
      "enum": ["extractor.endsAt", "rnd.completion", "travel.arrivesAt", "contracts.nextRefreshAt", "office.rentedUntil"],
      "description": "A timer that already exists in corporation state: corp.mining.silicateExtractors[].endsAt, queues.corporateRnD[].startedAt + durationHours, corp.travel.arrivesAt, corp.contractOfferings.nextRefreshAt, corp.offices[].rentedUntil. Later acts add refinery, fabrication and expedition timers the same way."
    },
    "step": {
      "type": "object",
      "required": ["id", "brief", "objective", "uses", "done"],
      "additionalProperties": false,
      "properties": {
        "id": { "type": "string", "pattern": "^[a-z0-9-]+$" },
        "speaker": { "$ref": "#/$defs/role", "description": "Defaults to the act's narrator." },
        "brief": {
          "type": "object",
          "description": "Shown once, when the step opens. Not shown at all when skipIfAlreadyMet applies.",
          "required": ["title", "text"],
          "additionalProperties": false,
          "properties": { "title": { "type": "string" }, "text": { "type": "string" } }
        },
        "objective": {
          "type": "object",
          "description": "Done when every condition in 'all' holds, or any condition in 'any' holds. The label is what the objective card shows.",
          "required": ["label"],
          "additionalProperties": false,
          "properties": {
            "label": { "type": "string" },
            "all": { "type": "array", "minItems": 1, "items": { "$ref": "#/$defs/condition" } },
            "any": { "type": "array", "minItems": 1, "items": { "$ref": "#/$defs/condition" } }
          },
          "oneOf": [{ "required": ["all"] }, { "required": ["any"] }]
        },
        "progress": {
          "type": "object",
          "description": "A number to show against a target on the objective card, when the objective itself is a yes or no.",
          "required": ["metric", "target"],
          "additionalProperties": false,
          "properties": { "metric": { "$ref": "#/$defs/metric" }, "target": { "type": "number" } }
        },
        "hints": {
          "type": "array",
          "description": "One-line nudges shown on the objective card while their condition holds. Never a popup.",
          "items": {
            "type": "object",
            "required": ["when", "text"],
            "additionalProperties": false,
            "properties": { "when": { "$ref": "#/$defs/hintCondition" }, "text": { "type": "string" } }
          }
        },
        "guide": {
          "type": "object",
          "description": "Where the objective card's Go button takes the player, in the walkthrough's shape (public/scripts/walkthrough.js): a tab and the element to highlight.",
          "required": ["tab", "selector"],
          "additionalProperties": false,
          "properties": {
            "tab": { "enum": ["overview", "inbox", "station", "finance", "rnd", "ceo", "refinery", "market", "assets", "logistics", "missions", "starmap", "travel"] },
            "selector": { "type": "string" }
          }
        },
        "uses": {
          "type": "object",
          "description": "The systems in the build this step relies on: route paths after /api/accounts/:accountId/ or /api/, and data files. tests/schema/quest-spine.test.js fails if one stops existing.",
          "required": ["routes", "data"],
          "additionalProperties": false,
          "properties": {
            "routes": { "type": "array", "items": { "type": "string" } },
            "data": { "type": "array", "items": { "type": "string" } }
          }
        },
        "skipIfAlreadyMet": {
          "type": "boolean",
          "description": "If the objective already holds when the step would open, complete it silently: no brief, no popup. For the player who did it before being asked."
        },
        "pending": {
          "type": "array",
          "description": "What is finishing without the player while this step is open, each with the thing it will give them. Shown on the objective card and in the return digest.",
          "items": {
            "type": "object",
            "required": ["source", "label", "payoff"],
            "additionalProperties": false,
            "properties": {
              "source": { "$ref": "#/$defs/pendingSource" },
              "label": { "type": "string" },
              "payoff": { "type": "string" }
            }
          }
        },
        "done": {
          "type": "object",
          "required": ["text"],
          "additionalProperties": false,
          "properties": {
            "text": { "type": "string" },
            "letter": {
              "type": "object",
              "description": "An inbox letter sent from the speaker when the step completes, through the existing message store.",
              "required": ["subject", "body"],
              "additionalProperties": false,
              "properties": { "subject": { "type": "string" }, "body": { "type": "string" } }
            }
          }
        }
      }
    }
  }
}
